{
  "$schema":"http://json-schema.org/draft-07/schema#","type":"object","additionalProperties":false,
  "required":["schema_version","tranche_id","status","scope","region","channel","created_at","observation_count","collector_version","evidence_ledger","immutability_policy","capture_basis","observations","governance"],
  "properties":{
    "schema_version":{"const":1},"tranche_id":{"type":"string","minLength":1},"status":{"const":"candidate_private_immutable"},"scope":{"const":"candidate_only"},"region":{"type":"string"},"channel":{"type":"string"},"created_at":{"type":"string","format":"date-time"},"observation_count":{"type":"integer","minimum":0},"collector_version":{"type":["integer","string"]},"evidence_ledger":{"type":"string","minLength":1},"immutability_policy":{"type":"string"},
    "capture_basis":{"type":"object","additionalProperties":false,"required":["observed_at_semantics","acquisition_method","run_id"],"properties":{"observed_at_semantics":{"type":"string"},"acquisition_method":{"type":"string"},"run_id":{"type":"string"}}},
    "observations":{"type":"array","items":{"$ref":"#/definitions/observation"}},"governance":{"$ref":"#/definitions/trancheGovernance"}
  },
  "definitions":{
    "falseFlags":{"type":"object"},
    "trancheGovernance":{"type":"object","additionalProperties":false,"required":["source_approved","methodology_approved","index_eligible","production_eligible","publication_eligible","public_claim_approved"],"properties":{"source_approved":{"const":false},"methodology_approved":{"const":false},"index_eligible":{"const":false},"production_eligible":{"const":false},"publication_eligible":{"const":false},"public_claim_approved":{"const":false}}},
    "observation":{"type":"object","additionalProperties":false,"required":["observation_id","status","scope","observed_at","product_key","source","identity","product","seller","item_price","availability","delivery","landed_price","qualification","evidence","governance"],"properties":{
      "observation_id":{"type":"string","minLength":1},"status":{"type":"string"},"scope":{"type":"string"},"observed_at":{"type":"string","format":"date-time"},"product_key":{"type":"string"},
      "source":{"type":"object","additionalProperties":false,"required":["source_key","source_name","source_url","supplied_url_status","collection_method","source_approved_for_production"],"properties":{"source_key":{"type":"string"},"source_name":{"type":"string"},"source_url":{"type":"string"},"supplied_url_status":{"type":"string"},"collection_method":{"type":"string"},"source_approved_for_production":{"const":false}}},
      "identity":{"type":"object","additionalProperties":false,"required":["mpn_expected","mpn_observed","match_basis"],"properties":{"mpn_expected":{"type":"string","minLength":1},"mpn_observed":{"type":"string","minLength":1},"match_basis":{"type":"string"}}},
      "product":{"type":"object","additionalProperties":false,"required":["capacity_gb","module_count","memory_type","capacity_basis","capacity_basis_reference"],"properties":{"capacity_gb":{"type":"integer"},"module_count":{"type":"integer"},"memory_type":{"type":"string"},"capacity_basis":{"type":"string"},"capacity_basis_reference":{"type":["string","null"]}}},
      "seller":{"type":"object","additionalProperties":false,"required":["display_name","legal_name","legal_name_state","relationship"],"properties":{"display_name":{"type":"string","minLength":1},"legal_name":{"type":["string","null"]},"legal_name_state":{"type":"string"},"relationship":{"type":"string"}}},
      "item_price":{"type":"object","additionalProperties":false,"required":["amount_minor","currency","vat_state"],"properties":{"amount_minor":{"type":"integer","minimum":1},"currency":{"type":"string"},"vat_state":{"type":"string"}}},
      "availability":{"type":"object","additionalProperties":false,"required":["normalised","schema","display","eligibility_semantics"],"properties":{"normalised":{"type":"string"},"schema":{"type":["string","null"]},"display":{"type":["string","null"]},"eligibility_semantics":{"type":"string"}}},
      "delivery":{"type":"object","additionalProperties":false,"required":["amount_minor","currency","claim","destination_basis","destination_verified"],"properties":{"amount_minor":{"type":["integer","null"]},"currency":{"type":"string"},"claim":{"type":["string","null"]},"destination_basis":{"type":["string","null"]},"destination_verified":{"type":"boolean"}}},
      "landed_price":{"type":"object","additionalProperties":false,"required":["amount_minor","currency","eligibility"],"properties":{"amount_minor":{"type":["integer","null"]},"currency":{"type":"string"},"eligibility":{"type":"string"}}},
      "qualification":{"type":"object","additionalProperties":false,"required":["status","item_price_minor","reasons"],"properties":{"status":{"type":"string"},"item_price_minor":{"type":"integer"},"reasons":{"type":"array","items":{"type":"string"}}}},
      "evidence":{"type":"object","additionalProperties":false,"required":["extract_path","extract_sha256","response_sha256","response_bytes","response_bytes_retained","source_url"],"properties":{"extract_path":{"type":"string"},"extract_sha256":{"type":["string","null"]},"response_sha256":{"type":"string","pattern":"^[0-9a-f]{64}$"},"response_bytes":{"type":"integer","minimum":0},"response_bytes_retained":{"const":false},"source_url":{"type":"string"}}},
      "governance":{"type":"object","additionalProperties":false,"required":["production_import_allowed","production_activation_allowed","index_eligibility","methodology_approval","publication_allowed"],"properties":{"production_import_allowed":{"const":false},"production_activation_allowed":{"const":false},"index_eligibility":{"const":false},"methodology_approval":{"const":false},"publication_allowed":{"const":false}}}
    }}
  }
}
