{
  "schema_version": 1,
  "tranche_id": "sf-gb-primary-retail-20261015T103005Z-v1",
  "status": "candidate_private_immutable",
  "scope": "candidate_only",
  "region": "GB",
  "channel": "PRIMARY_RETAIL",
  "created_at": "2026-10-15T10:30:05Z",
  "observation_count": 33,
  "collector_version": 1,
  "evidence_ledger": "research/evidence/primary-retail-20261015T103005Z/ledger.v1.json",
  "immutability_policy": "Append-only candidate observation tranche; do not edit in place. Corrections require a new additive artifact.",
  "capture_basis": {
    "observed_at_semantics": "Time of retrieval by the canonical collector; the retailer's own price-change time is not observed.",
    "acquisition_method": "Scheduled unattended retrieval of exact-MPN product pages listed in data/catalogue/collection-targets.v1.json. One request at a time with a delay between requests, an identifying user-agent, and robots.txt honoured per host.",
    "run_id": "sf-collection-run-20261015T103005Z"
  },
  "observations": [
    {
      "observation_id": "awd-it-ra50d516gx2-5600c36a-2026-10-15t10:30:05z",
      "status": "candidate_private_immutable",
      "scope": "candidate_only",
      "observed_at": "2026-10-15T10:30:05Z",
      "product_key": "ra50d516gx2-5600c36a",
      "source": {
        "source_key": "awd-it-uk-public-page",
        "source_name": "AWD-IT public product page",
        "source_url": "https://www.awd-it.co.uk/thermaltake-toughram-rc-d5-32gb-2x16gb-ddr5-5600mt-s-c36-memory-ra50d516gx2-5600c36a.html",
        "supplied_url_status": "http_200",
        "collection_method": "scheduled unattended HTTP retrieval by the canonical collector",
        "source_approved_for_production": false
      },
      "identity": {
        "mpn_expected": "RA50D516GX2-5600C36A",
        "mpn_observed": "RA50D516GX2-5600C36A",
        "match_basis": "exact_mpn"
      },
      "product": {
        "capacity_gb": 32,
        "module_count": 2,
        "memory_type": "DDR5",
        "capacity_basis": "visible_on_page",
        "capacity_basis_reference": null
      },
      "seller": {
        "display_name": "AWD-IT",
        "legal_name": "ADMI Limited",
        "legal_name_state": "established_from_prior_retained_extract",
        "relationship": "retailer_owned"
      },
      "item_price": {
        "amount_minor": 39999,
        "currency": "GBP",
        "vat_state": "included"
      },
      "availability": {
        "normalised": "unknown",
        "schema": null,
        "display": null,
        "eligibility_semantics": "unknown"
      },
      "delivery": {
        "amount_minor": null,
        "currency": "GBP",
        "claim": null,
        "destination_basis": null,
        "destination_verified": false
      },
      "landed_price": {
        "amount_minor": null,
        "currency": "GBP",
        "eligibility": "abstain"
      },
      "qualification": {
        "status": "candidate_retained_not_landed_price_eligible",
        "item_price_minor": 39999,
        "reasons": [
          "delivery_not_read_by_collector"
        ]
      },
      "evidence": {
        "extract_path": "research/evidence/primary-retail-20261015T103005Z/ledger.v1.json",
        "extract_sha256": null,
        "response_sha256": "b271a34ffa31cc852a83fbc542e1f2471ee9aa00be0e44f5fd4041fd79646496",
        "response_bytes": 398545,
        "response_bytes_retained": false,
        "source_url": "https://www.awd-it.co.uk/thermaltake-toughram-rc-d5-32gb-2x16gb-ddr5-5600mt-s-c36-memory-ra50d516gx2-5600c36a.html"
      },
      "governance": {
        "production_import_allowed": false,
        "production_activation_allowed": false,
        "index_eligibility": false,
        "methodology_approval": false,
        "publication_allowed": false
      }
    },
    {
      "observation_id": "awd-it-f5-6000j3636f16gx2-fx5-2026-10-15t10:30:05z",
      "status": "candidate_private_immutable",
      "scope": "candidate_only",
      "observed_at": "2026-10-15T10:30:05Z",
      "product_key": "f5-6000j3636f16gx2-fx5",
      "source": {
        "source_key": "awd-it-uk-public-page",
        "source_name": "AWD-IT public product page",
        "source_url": "https://www.awd-it.co.uk/g-skill-flare-x5-32gb-16gb-x2-ddr5-6000mt-s-cl36-memory-kit-black-f5-6000j3636f16gx2-fx5.html",
        "supplied_url_status": "http_200",
        "collection_method": "scheduled unattended HTTP retrieval by the canonical collector",
        "source_approved_for_production": false
      },
      "identity": {
        "mpn_expected": "F5-6000J3636F16GX2-FX5",
        "mpn_observed": "F5-6000J3636F16GX2-FX5",
        "match_basis": "exact_mpn"
      },
      "product": {
        "capacity_gb": 32,
        "module_count": 2,
        "memory_type": "DDR5",
        "capacity_basis": "visible_on_page",
        "capacity_basis_reference": null
      },
      "seller": {
        "display_name": "AWD-IT",
        "legal_name": "ADMI Limited",
        "legal_name_state": "established_from_prior_retained_extract",
        "relationship": "retailer_owned"
      },
      "item_price": {
        "amount_minor": 56199,
        "currency": "GBP",
        "vat_state": "included"
      },
      "availability": {
        "normalised": "unknown",
        "schema": null,
        "display": null,
        "eligibility_semantics": "unknown"
      },
      "delivery": {
        "amount_minor": null,
        "currency": "GBP",
        "claim": null,
        "destination_basis": null,
        "destination_verified": false
      },
      "landed_price": {
        "amount_minor": null,
        "currency": "GBP",
        "eligibility": "abstain"
      },
      "qualification": {
        "status": "candidate_retained_not_landed_price_eligible",
        "item_price_minor": 56199,
        "reasons": [
          "delivery_not_read_by_collector"
        ]
      },
      "evidence": {
        "extract_path": "research/evidence/primary-retail-20261015T103005Z/ledger.v1.json",
        "extract_sha256": null,
        "response_sha256": "3c14fae445dc91636651335605f82ab771b36f86bb9b440911305a41f07c6945",
        "response_bytes": 406395,
        "response_bytes_retained": false,
        "source_url": "https://www.awd-it.co.uk/g-skill-flare-x5-32gb-16gb-x2-ddr5-6000mt-s-cl36-memory-kit-black-f5-6000j3636f16gx2-fx5.html"
      },
      "governance": {
        "production_import_allowed": false,
        "production_activation_allowed": false,
        "index_eligibility": false,
        "methodology_approval": false,
        "publication_allowed": false
      }
    },
    {
      "observation_id": "kingstonmemoryshop-kf560c30bbek2-32-2026-10-15t10:30:05z",
      "status": "candidate_private_immutable",
      "scope": "candidate_only",
      "observed_at": "2026-10-15T10:30:05Z",
      "product_key": "kf560c30bbek2-32",
      "source": {
        "source_key": "kingstonmemoryshop-uk-public-page",
        "source_name": "KingstonMemoryShop public product page",
        "source_url": "https://www.kingstonmemoryshop.co.uk/kingston-fury-beast-kf560c30bbek2-32-32gb-16gb-x2-ddr5-6000mt-s-black-memory-dimm-expo",
        "supplied_url_status": "http_200",
        "collection_method": "scheduled unattended HTTP retrieval by the canonical collector",
        "source_approved_for_production": false
      },
      "identity": {
        "mpn_expected": "KF560C30BBEK2-32",
        "mpn_observed": "KF560C30BBEK2-32",
        "match_basis": "exact_mpn"
      },
      "product": {
        "capacity_gb": 32,
        "module_count": 2,
        "memory_type": "DDR5",
        "capacity_basis": "visible_on_page",
        "capacity_basis_reference": null
      },
      "seller": {
        "display_name": "KingstonMemoryShop",
        "legal_name": "SweetCow Ltd t/a KingstonMemoryShop",
        "legal_name_state": "established_from_prior_retained_extract",
        "relationship": "retailer_owned"
      },
      "item_price": {
        "amount_minor": 71993,
        "currency": "GBP",
        "vat_state": "included"
      },
      "availability": {
        "normalised": "in_stock",
        "schema": "In stock",
        "display": "In stock",
        "eligibility_semantics": "explicit"
      },
      "delivery": {
        "amount_minor": null,
        "currency": "GBP",
        "claim": null,
        "destination_basis": null,
        "destination_verified": false
      },
      "landed_price": {
        "amount_minor": null,
        "currency": "GBP",
        "eligibility": "abstain"
      },
      "qualification": {
        "status": "candidate_retained_not_landed_price_eligible",
        "item_price_minor": 71993,
        "reasons": [
          "delivery_not_read_by_collector"
        ]
      },
      "evidence": {
        "extract_path": "research/evidence/primary-retail-20261015T103005Z/ledger.v1.json",
        "extract_sha256": null,
        "response_sha256": "65fd281a0927940828829ca859b453c1dc1d8f90c6f70e8211cf1cb177132b87",
        "response_bytes": 614818,
        "response_bytes_retained": false,
        "source_url": "https://www.kingstonmemoryshop.co.uk/kingston-fury-beast-kf560c30bbek2-32-32gb-16gb-x2-ddr5-6000mt-s-black-memory-dimm-expo"
      },
      "governance": {
        "production_import_allowed": false,
        "production_activation_allowed": false,
        "index_eligibility": false,
        "methodology_approval": false,
        "publication_allowed": false
      }
    },
    {
      "observation_id": "kingstonmemoryshop-kf564c32rsk2-32-2026-10-15t10:30:05z",
      "status": "candidate_private_immutable",
      "scope": "candidate_only",
      "observed_at": "2026-10-15T10:30:05Z",
      "product_key": "kf564c32rsk2-32",
      "source": {
        "source_key": "kingstonmemoryshop-uk-public-page",
        "source_name": "KingstonMemoryShop public product page",
        "source_url": "https://www.kingstonmemoryshop.co.uk/kingston-fury-renegade-silver-kf564c32rsk2-32-32gb-16gb-x2-ddr5-6400mt-s-non-ecc-dimm",